{
  "id": "manual:https://example.com/ai-agent",
  "source": "manual",
  "title": "AI Agent 與工作流",
  "url": "https://example.com/ai-agent",
  "language": "zh-TW",
  "content": "AI Agent 不應只負責生成文字，也應根據工具結果規劃下一步。",
  "images": [],
  "tags": [
    "AI",
    "n8n"
  ],
  "score": 0,
  "shouldWrite": false,
  "analysis": {},
  "metadata": {
    "createdAt": "2026-07-16T00:00:00.000Z",
    "collector": "fixture",
    "version": "1.0.0",
    "status": "normalized"
  }
}